{
  "run_id": "run",
  "session_id": "transcript",
  "conversation_session_id": "fixed",
  "status": "completed",
  "approval_results": [],
  "schema": "hermes.run.v2",
  "shape_sha256": "b725baece0ba60cdcf1789b5964224e94a08768c3cd252ed30a12a517ebda210",
  "profile_home": "/tmp/paios-fixture/native-profile"
}
