{
  "run_id": "run_acc8cbf9fd134faeb9e217d9a326fe55",
  "status": "completed",
  "session_id": "20261002_124123_05ce2f",
  "conversation_session_id": "admitted-parent",
  "output": "controlled source callback, model calls zero",
  "approval_results": [],
  "schema": "hermes.run.v2",
  "shape_sha256": "b725baece0ba60cdcf1789b5964224e94a08768c3cd252ed30a12a517ebda210",
  "profile_home": "/tmp/pytest-of-user/pytest-0/test_native_worker_status0/hermes_test"
}
