{
  "run_id": "run",
  "session_id": "session",
  "conversation_session_id": "conversation",
  "status": "completed",
  "output": "{\"reply_id\":\"this is legitimate user JSON\"}",
  "native_final_response": {
    "schema": "hermes.final-response.v1",
    "run_id": "run",
    "turn_id": "turn",
    "after_tool_call_id": "open",
    "after_tool_name": "paios_open_reply",
    "phase": "final_buffer",
    "session_id": "session",
    "message_id": 3,
    "sha256": "456edfb76a10e3cb7427cc3457dcbdb094a98de55c24fcdaac4df517c301eb2a",
    "previous_message_id": 2,
    "previous_message_role": "tool",
    "last_tool_message_id": 2
  },
  "approval_results": [],
  "schema": "hermes.run.v2",
  "shape_sha256": "f5ecab354c673aa7354730b9d1fa03ccedcc3d47fdb1ccd3b8383b89d4c749e8",
  "profile_home": "/tmp/paios-fixture/native-profile"
}
